<?xml version="1.0" encoding="UTF-8"?>
<orders
        xmlns="http://luksha.it-academy.by/xml/orders"
        xmlns:xsi="http://www.w3.org/2001/XMLSchema-instance"
        xsi:schemaLocation="http://luksha.it-academy.by/xml/orders orders.xsd">
    <order>
        <ID>1</ID>
        <FK_User>1</FK_User>
        <FK_Car>1</FK_Car>
        <StartRent>2016-06-29 22:00:01</StartRent>
        <EndRent>2016-06-30 22:00:01</EndRent>
        <TotalCost>120</TotalCost>
    </order>
</orders>